{
  "schema_version": 1,
  "candidate": "gpui-kit",
  "device": "desktop_linux",
  "device_model": "unknown",
  "os_version": "Ubuntu 24.04.5 LTS kernel 6.18.44-fc-v180",
  "date": "2026-10-28",
  "pinned": {
    "gpui_rev": "gpui-pre@0.3.10",
    "gpui_component_rev": "c8917c3661ed1090870f403c312b39e0d8a62e0b"
  },
  "gate": "binary_size",
  "kind": "numeric",
  "unit": "MB",
  "threshold": 80,
  "statistic": "single",
  "value": 45.9199,
  "samples": [
    45.9199
  ],
  "p50": 45.9199,
  "p95": 45.9199,
  "pass": true,
  "evidence": [
    "spikes/bench/results/gpui-kit/desktop_linux/raw"
  ],
  "notes": "stripped release binary (strip -o copy of gpui-spike), decimal MB. spike commit 6ac70a8; release build; xvfb-run -s \"-screen 0 1280x800x24\"; renderer lavapipe (VK_ICD_FILENAMES=/usr/share/vulkan/icd.d/lvp_icd.json); fixture transcript-10k at 200 ev/s"
}
