{
  "schema_version": 1,
  "candidate": "gpui-kit",
  "device": "desktop_linux",
  "device_model": "unknown",
  "os_version": "Ubuntu 24.04.5 LTS kernel 6.18.44-fc-v180",
  "date": "2026-10-28",
  "pinned": {
    "gpui_rev": "gpui-pre@0.3.10",
    "gpui_component_rev": "c8917c3661ed1090870f403c312b39e0d8a62e0b"
  },
  "gate": "cold_start",
  "kind": "numeric",
  "unit": "s",
  "threshold": 1.5,
  "statistic": "median_of_runs",
  "value": 0.1541,
  "samples": [
    0.1507,
    0.1541,
    0.1517,
    0.1587,
    0.1549
  ],
  "p50": 0.1541,
  "p95": 0.1587,
  "runs": [
    {
      "run": 1,
      "n": 1,
      "value": 0.1507
    },
    {
      "run": 2,
      "n": 1,
      "value": 0.1541
    },
    {
      "run": 3,
      "n": 1,
      "value": 0.1517
    },
    {
      "run": 4,
      "n": 1,
      "value": 0.1587
    },
    {
      "run": 5,
      "n": 1,
      "value": 0.1549
    }
  ],
  "pass": true,
  "evidence": [
    "spikes/bench/results/gpui-kit/desktop_linux/raw"
  ],
  "notes": "process start (wrapper pre-exec timestamp) to first interactive frame; median of 5 runs. spike commit 6ac70a8; release build; xvfb-run -s \"-screen 0 1280x800x24\"; renderer lavapipe (VK_ICD_FILENAMES=/usr/share/vulkan/icd.d/lvp_icd.json); fixture transcript-10k at 200 ev/s"
}
